{"$schema":"https://json-schema.org/draft/2020-12/schema","$id":"comparison-result.schema.json","title":"ComparisonModel v1 Result","type":"object","additionalProperties":false,"required":["schema_version","comparison_id","calculation_status","engine_version","baseline_variant_id","variants","failed_variant_ids"],"properties":{"schema_version":{"const":"comparison-result-1.0.0"},"comparison_id":{"type":"string","minLength":1,"maxLength":120},"calculation_status":{"const":"OK"},"engine_version":{"const":"1.0.0"},"baseline_variant_id":{"type":"string","minLength":1,"maxLength":120},"variants":{"type":"array","minItems":2,"maxItems":4,"items":{"$ref":"#/$defs/variantResult"}},"failed_variant_ids":{"type":"array","maxItems":0}},"$defs":{"delta":{"type":"object","additionalProperties":false,"required":["absolute","relative"],"properties":{"absolute":{"type":"number"},"relative":{"type":["number","null"]}}},"metrics":{"type":"object","additionalProperties":false,"required":["nominal_value","real_value","cumulative_contributions","cumulative_entry_fees","cumulative_ongoing_fees","cumulative_fixed_fees","cumulative_total_fees","net_gain"],"properties":{"nominal_value":{"type":"number"},"real_value":{"type":"number"},"cumulative_contributions":{"type":"number"},"cumulative_entry_fees":{"type":"number"},"cumulative_ongoing_fees":{"type":"number"},"cumulative_fixed_fees":{"type":"number"},"cumulative_total_fees":{"type":"number"},"net_gain":{"type":"number"}}},"deltas":{"type":"object","additionalProperties":false,"required":["nominal_value","real_value","cumulative_contributions","cumulative_entry_fees","cumulative_ongoing_fees","cumulative_fixed_fees","cumulative_total_fees","net_gain"],"properties":{"nominal_value":{"$ref":"#/$defs/delta"},"real_value":{"$ref":"#/$defs/delta"},"cumulative_contributions":{"$ref":"#/$defs/delta"},"cumulative_entry_fees":{"$ref":"#/$defs/delta"},"cumulative_ongoing_fees":{"$ref":"#/$defs/delta"},"cumulative_fixed_fees":{"$ref":"#/$defs/delta"},"cumulative_total_fees":{"$ref":"#/$defs/delta"},"net_gain":{"$ref":"#/$defs/delta"}}},"variantResult":{"type":"object","additionalProperties":false,"required":["id","name","result","delta_vs_baseline"],"properties":{"id":{"type":"string","minLength":1,"maxLength":120},"name":{"type":"string","minLength":1,"maxLength":80},"result":{"$ref":"#/$defs/metrics"},"delta_vs_baseline":{"$ref":"#/$defs/deltas"}}}}}