{"baseline_variant_id":"variant_a","calculation_status":"OK","comparison_id":"cmp_c01","engine_version":"1.0.0","failed_variant_ids":[],"schema_version":"comparison-result-1.0.0","variants":[{"delta_vs_baseline":{"cumulative_contributions":{"absolute":0.0,"relative":0.0},"cumulative_entry_fees":{"absolute":0.0,"relative":0.0},"cumulative_fixed_fees":{"absolute":0.0,"relative":0.0},"cumulative_ongoing_fees":{"absolute":0.0,"relative":0.0},"cumulative_total_fees":{"absolute":0.0,"relative":0.0},"net_gain":{"absolute":0.0,"relative":0.0},"nominal_value":{"absolute":0.0,"relative":0.0},"real_value":{"absolute":0.0,"relative":0.0}},"id":"variant_a","name":"A","result":{"cumulative_contributions":700000.0,"cumulative_entry_fees":0.0,"cumulative_fixed_fees":0.0,"cumulative_ongoing_fees":0.0,"cumulative_total_fees":0.0,"net_gain":237371.1603682168,"nominal_value":937371.1603682168,"real_value":732403.0404885577}},{"delta_vs_baseline":{"cumulative_contributions":{"absolute":0.0,"relative":0.0},"cumulative_entry_fees":{"absolute":0.0,"relative":null},"cumulative_fixed_fees":{"absolute":0.0,"relative":null},"cumulative_ongoing_fees":{"absolute":0.0,"relative":null},"cumulative_total_fees":{"absolute":0.0,"relative":null},"net_gain":{"absolute":129806.53035069781,"relative":0.5468395281532256},"nominal_value":{"absolute":129806.53035069781,"relative":0.1384803937489467},"real_value":{"absolute":101429.01962047874,"relative":0.13848039374894675}},"id":"variant_b","name":"B","result":{"cumulative_contributions":700000.0,"cumulative_entry_fees":0.0,"cumulative_fixed_fees":0.0,"cumulative_ongoing_fees":0.0,"cumulative_total_fees":0.0,"net_gain":367177.6907189146,"nominal_value":1067177.6907189146,"real_value":833832.0601090364}}]}
